creation_date,business_name,contact_name,contact_phone,email_contact,business_descrition,name_service_contact,phone_service_contact,email_service_contact,user_id,address_id
2019-06-03,Aliquam Ultrices Industries,Axel Townsend,948-288-0785,non.nisi@risus.com,eros viverra eget congue eget semper rutrum nulla nunc purus,Euphemia Grahlmans,581-929-3583,egrahlmans0@comsenz.com,11,1
2019-04-09,Iaculis Foundation,Basil Small,409-760-9291,et.malesuada@Etiam.ca,nunc nisl duis bibendum felis sed interdum venenatis turpis enim,Zak Pughsley,323-505-7540,zpughsley1@domainmarket.com,12,2
2019-05-18,Lorem Associates,Lara Mcclure,356-215-6250,aliquet.molestie@gravidasagittis.net,erat volutpat in congue etiam justo etiam pretium iaculis justo,Priscella Lismore,973-629-2781,plismore2@alibaba.com,13,3
2018-08-07,Augue Sed Corporation,Nash Hart,724-794-9049,semper.pretium.neque@Aeneanegetmagna.com,felis eu sapien cursus vestibulum proin eu mi nulla ac,Bernarr Brock,516-563-5368,bbrock3@state.tx.us,14,4
2018-07-19,Cras Eget Associates,Fleur Bass,294-177-4508,mollis.dui@Aliquamadipiscing.co.uk,tortor quis turpis sed ante vivamus tortor duis mattis egestas,Sebastiano Wainman,658-196-7902,swainman4@sakura.ne.jp,15,5
2019-04-04,Shuffletag,Walton Boast,573-637-5893,fdrance5@earthlink.net,integer pede justo lacinia eget tincidunt eget tempus vel pede,Flossie Drance,867-741-0454,fdrance5@hubpages.com,16,6
2018-07-22,Skidoo,Lorena Ronca,219-353-8160,gmitrovic6@imageshack.us,elit ac nulla sed vel enim sit amet nunc viverra,Glenden Mitrovic,466-385-7609,gmitrovic6@desdev.cn,17,7
2019-04-17,Browsetype,Robbi Buzza,222-752-9663,pde7@guardian.co.uk,justo maecenas rhoncus aliquam lacus morbi quis tortor id nulla,Pip De Paoli,634-747-5501,pde7@oaic.gov.au,18,8
2019-05-19,Trudeo,Sherrie Gourlie,111-616-6258,garkell8@amazon.com,in tempor turpis nec euismod scelerisque quam turpis adipiscing lorem,Godfry Arkell,473-244-8146,garkell8@soundcloud.com,19,9
2019-02-24,Voonte,Dawn MacCathay,671-173-7277,rchapell9@thetimes.co.uk,tincidunt nulla mollis molestie lorem quisque ut erat curabitur gravida,Robinette Chapell,575-411-0437,rchapell9@is.gd,20,10
2018-10-09,Yombu,Natala Huggon,808-687-1351,acapina@china.com.cn,aliquam sit amet diam in magna bibendum imperdiet nullam orci,Ansel Capin,106-341-8774,acapina@ustream.tv,21,11
2019-04-20,Jabbertype,Cordell Billett,769-486-7074,dchatb@cornell.edu,quisque erat eros viverra eget congue eget semper rutrum nulla,Dolores Chat,427-831-1697,dchatb@tinyurl.com,22,12
2018-12-13,Youspan,Nealson Hinkensen,698-622-5880,mpittawayc@sbwire.com,tincidunt eget tempus vel pede morbi porttitor lorem id ligula,Merrielle Pittaway,489-958-7800,mpittawayc@dyndns.org,23,13
2018-08-28,Devcast,Marlie Kilduff,235-393-2953,klinded@goo.ne.jp,eros suspendisse accumsan tortor quis turpis sed ante vivamus tortor,Kim Linde,157-869-2978,klinded@ovh.net,24,14
2019-03-09,Aimbo,Clayson Gallymore,610-159-9994,pcalleare@domainmarket.com,elementum eu interdum eu tincidunt in leo maecenas pulvinar lobortis,Patricio Callear,548-202-4128,pcalleare@pagesperso-orange.fr,25,15
2019-04-20,Digitube,Emmett Stirton,695-979-2342,ftembridgef@livejournal.com,mi pede malesuada in imperdiet et commodo vulputate justo in,Florinda Tembridge,117-481-7296,ftembridgef@imgur.com,26,16
2019-02-28,Voonte,Drucie Crosgrove,729-744-6785,cprayg@spiegel.de,magna ac consequat metus sapien ut nunc vestibulum ante ipsum,Carri Pray,758-373-3966,cprayg@hugedomains.com,27,17
2018-11-09,Yambee,Fin Taveriner,187-754-0678,gdelosh@walmart.com,duis bibendum morbi non quam nec dui luctus rutrum nulla,Gran Delos,755-562-7808,gdelosh@bluehost.com,28,18
2018-08-11,Thoughtblab,Pepillo Priddle,441-514-6418,mfreeri@google.com.br,purus aliquet at feugiat non pretium quis lectus suspendisse potenti,Marita Freer,513-260-1847,mfreeri@bbb.org,29,19
2019-04-27,Twitterbeat,Debee Legerton,380-101-3572,ereedmanj@fda.gov,eget elit sodales scelerisque mauris sit amet eros suspendisse accumsan,Emlyn Reedman,222-821-3161,ereedmanj@taobao.com,30,20
2019-05-19,Zoombeat,Gustie Weight,784-401-4890,phaywoodk@mac.com,venenatis non sodales sed tincidunt eu felis fusce posuere felis,Pietrek Haywood,937-529-5886,phaywoodk@themeforest.net,31,21
2018-12-29,Realmix,Meyer Treadwell,295-500-9881,jmccaughrenl@vinaora.com,vel augue vestibulum ante ipsum primis in faucibus orci luctus,Judi McCaughren,597-934-3472,jmccaughrenl@blog.com,32,22
2019-07-05,Mybuzz,Thaine Barkworth,949-968-6439,galdrichm@canalblog.com,mi pede malesuada in imperdiet et commodo vulputate justo in,Gary Aldrich,873-828-6021,galdrichm@creativecommons.org,33,23
2018-10-14,Blogtag,Janeen Hammatt,367-144-1164,mhabdenn@boston.com,consequat varius integer ac leo pellentesque ultrices mattis odio donec,Martha Habden,752-874-9126,mhabdenn@si.edu,34,24
2019-05-23,Skynoodle,Clemmie Han,718-411-3649,rherrieveno@furl.net,nulla neque libero convallis eget eleifend luctus ultricies eu nibh,Ragnar Herrieven,865-898-0916,rherrieveno@state.tx.us,35,25
2018-08-01,Skyba,Bald Duferie,609-572-0150,bneemp@omniture.com,erat vestibulum sed magna at nunc commodo placerat praesent blandit,Bald Neem,864-410-1033,bneemp@ameblo.jp,36,26
2019-05-27,Dabfeed,Sande Farrow,882-311-2859,mcostleyq@squarespace.com,eu nibh quisque id justo sit amet sapien dignissim vestibulum,Miltie Costley,964-750-5767,mcostleyq@sitemeter.com,37,27
2019-06-27,Gabtype,Jacquelin Sibylla,429-646-1295,jsorrellr@networksolutions.com,pede justo lacinia eget tincidunt eget tempus vel pede morbi,Jazmin Sorrell,336-232-9918,jsorrellr@go.com,38,28
2018-12-29,Brainbox,Chelsie Gillespey,207-440-5010,jheinickes@youtube.com,sapien placerat ante nulla justo aliquam quis turpis eget elit,Janey Heinicke,839-914-4273,jheinickes@merriam-webster.com,39,29
2018-10-13,Tavu,Fanechka Lyddon,280-834-0511,tshearmant@simplemachines.org,nec sem duis aliquam convallis nunc proin at turpis a,Teena Shearman,170-731-4740,tshearmant@umich.edu,40,30
2019-01-20,Centizu,Katrinka Dorney,783-432-0481,edaglishu@qq.com,eu interdum eu tincidunt in leo maecenas pulvinar lobortis est,Ezri Daglish,461-446-4952,edaglishu@twitpic.com,41,31
2019-06-12,Eamia,Gerhard Britzius,266-899-9627,nluxmoorev@admin.ch,justo in hac habitasse platea dictumst etiam faucibus cursus urna,Nomi Luxmoore,133-344-7025,nluxmoorev@bluehost.com,42,32
2018-10-06,Quimba,Silvanus Malpas,557-247-1655,lglasonw@domainmarket.com,iaculis diam erat fermentum justo nec condimentum neque sapien placerat,Lucila Glason,896-873-9276,lglasonw@parallels.com,43,33
2018-08-29,Edgeblab,Garald Edge,708-805-9581,igrederx@cnn.com,congue elementum in hac habitasse platea dictumst morbi vestibulum velit,Izzy Greder,593-544-8143,igrederx@unesco.org,44,34
2018-10-03,Avaveo,Elvera Lowless,190-426-4033,neffordy@cpanel.net,montes nascetur ridiculus mus vivamus vestibulum sagittis sapien cum sociis,Nikolas Efford,438-553-2837,neffordy@bigcartel.com,45,35
2019-01-31,Jaxworks,Dawna Hambidge,202-946-4842,hclarsonz@salon.com,vivamus vestibulum sagittis sapien cum sociis natoque penatibus et magnis,Hilda Clarson,748-380-7836,hclarsonz@sbwire.com,46,36
2019-04-23,Ntags,Dylan Piff,177-865-3247,cmcnaught10@patch.com,ultrices posuere cubilia curae duis faucibus accumsan odio curabitur convallis,Correy McNaught,775-580-6321,cmcnaught10@nbcnews.com,47,37
2019-03-17,Flashspan,Rosabel Arntzen,835-674-4092,mpetrou11@twitter.com,vehicula consequat morbi a ipsum integer a nibh in quis,Mylo Petrou,976-812-1045,mpetrou11@ustream.tv,48,38
2018-10-28,Quire,Jewell Jewster,799-284-2788,cfortnum12@tripod.com,eu interdum eu tincidunt in leo maecenas pulvinar lobortis est,Crissy Fortnum,307-870-6822,cfortnum12@sitemeter.com,49,39
2018-12-05,Babblestorm,Antonio Moorwood,888-628-5700,kbeswell13@free.fr,nam ultrices libero non mattis pulvinar nulla pede ullamcorper augue,Koren Beswell,343-435-9487,kbeswell13@storify.com,50,40
2019-01-30,Oba,Lonnie Yeardley,905-127-0817,ncodron14@wufoo.com,in leo maecenas pulvinar lobortis est phasellus sit amet erat,Neel Codron,881-778-2608,ncodron14@alexa.com,51,41
2018-08-14,Brightdog,Zara Younghusband,179-247-8225,cchristophers15@mlb.com,auctor gravida sem praesent id massa id nisl venenatis lacinia,Consalve Christophers,827-678-2346,cchristophers15@skype.com,52,42
2018-08-21,Jaxworks,Bert Koles,749-807-1007,shouson16@t.co,dui proin leo odio porttitor id consequat in consequat ut,Sybila Houson,375-827-5682,shouson16@gov.uk,53,43
2018-09-09,Agivu,Levin Colbrun,241-480-1821,wbutts17@msu.edu,sit amet nulla quisque arcu libero rutrum ac lobortis vel,Westley Butts,532-337-7956,wbutts17@umich.edu,54,44
2018-09-04,Voonder,Noni Janny,988-290-1553,bdobrowolny18@dropbox.com,id lobortis convallis tortor risus dapibus augue vel accumsan tellus,Beck Dobrowolny,952-430-7471,bdobrowolny18@google.es,55,45
2019-07-06,Fivechat,Holly Lukas,114-681-0434,aisley19@taobao.com,mattis nibh ligula nec sem duis aliquam convallis nunc proin,Andeee Isley,611-787-7478,aisley19@sohu.com,56,46
2018-10-19,Ntag,Linet Wildish,871-931-4808,vwadsworth1a@seattletimes.com,pretium iaculis justo in hac habitasse platea dictumst etiam faucibus,Vicki Wadsworth,334-196-9561,vwadsworth1a@statcounter.com,57,47
2019-02-09,Trilith,Joline MacFaell,228-562-3763,jsalerg1b@shinystat.com,purus eu magna vulputate luctus cum sociis natoque penatibus et,Jean Salerg,316-122-0302,jsalerg1b@aboutads.info,58,48
2018-07-28,Wordify,Clareta Kaas,202-235-1275,nbouts1c@usa.gov,ultrices libero non mattis pulvinar nulla pede ullamcorper augue a,Norri Bouts,707-540-0426,nbouts1c@businessweek.com,59,49
2019-03-08,Kwinu,Hedwiga Grocock,315-561-8938,twoolmington1d@webnode.com,sit amet justo morbi ut odio cras mi pede malesuada,Tori Woolmington,283-895-3827,twoolmington1d@java.com,60,50
2018-12-14,Fivechat,Sheffie Andrich,374-926-0503,gohanley1e@ft.com,nisl nunc rhoncus dui vel sem sed sagittis nam congue,Glori OHanley,568-217-5490,gohanley1e@nytimes.com,61,51
2018-08-05,Roodel,Annabell Millmore,209-309-9808,gcurran1f@weather.com,sit amet sapien dignissim vestibulum vestibulum ante ipsum primis in,Gusti Curran,506-280-9783,gcurran1f@gizmodo.com,62,52
2019-04-23,Youfeed,Hugo Mattys,204-966-0623,cewings1g@qq.com,pellentesque viverra pede ac diam cras pellentesque volutpat dui maecenas,Cathlene Ewings,328-553-9649,cewings1g@trellian.com,63,53
2019-05-06,Teklist,Pennie Espley,927-623-9517,elaterza1h@pinterest.com,at lorem integer tincidunt ante vel ipsum praesent blandit lacinia,Emera Laterza,704-591-2418,elaterza1h@google.ca,64,54
2018-09-12,Tagfeed,Eachelle Dallewater,514-133-5347,sskeermor1i@dell.com,sapien in sapien iaculis congue vivamus metus arcu adipiscing molestie,Skippy Skeermor,923-927-8966,sskeermor1i@nifty.com,65,55
2018-09-01,Rhyloo,Mamie Tobin,863-397-1184,lleslie1j@census.gov,luctus et ultrices posuere cubilia curae mauris viverra diam vitae,Lorie Leslie,139-534-9565,lleslie1j@last.fm,66,56
2019-04-03,Tagcat,Vito Pethrick,971-418-1048,aalbiston1k@webeden.co.uk,quis orci nullam molestie nibh in lectus pellentesque at nulla,Abdel Albiston,614-677-5076,aalbiston1k@utexas.edu,67,57
2019-02-16,Abata,Lynnelle Tallet,287-397-4890,ffransoni1l@craigslist.org,adipiscing lorem vitae mattis nibh ligula nec sem duis aliquam,Florian Fransoni,800-365-9284,ffransoni1l@cpanel.net,68,58
2019-05-13,Skiptube,Buffy Cawtheray,132-963-3661,fbresman1m@wikia.com,venenatis tristique fusce congue diam id ornare imperdiet sapien urna,Fowler Bresman,228-344-3113,fbresman1m@geocities.jp,69,59
2019-03-05,Layo,Bartolemo Hernik,437-489-1280,wperkinson1n@oaic.gov.au,in eleifend quam a odio in hac habitasse platea dictumst,Werner Perkinson,519-504-7892,wperkinson1n@delicious.com,70,60
2019-01-04,Riffpedia,Solly Rainard,139-919-6639,jbrowell1o@com.com,dolor sit amet consectetuer adipiscing elit proin interdum mauris non,Jed Browell,421-130-4687,jbrowell1o@theglobeandmail.com,71,61
2018-08-26,Tagtune,Della Baumber,825-400-5833,vwoltman1p@berkeley.edu,posuere felis sed lacus morbi sem mauris laoreet ut rhoncus,Vincents Woltman,805-718-6708,vwoltman1p@google.es,72,62
2019-03-30,Jabbertype,Garry Aleksich,540-714-7407,maery1q@123-reg.co.uk,amet diam in magna bibendum imperdiet nullam orci pede venenatis,Michell Aery,774-417-9025,maery1q@spotify.com,73,63
2019-03-02,Ozu,Buck Paulin,936-871-2639,mmarre1r@oracle.com,et magnis dis parturient montes nascetur ridiculus mus etiam vel,Margalo Marre,697-349-8135,mmarre1r@upenn.edu,74,64
2019-01-20,Quinu,Roscoe Beamiss,757-612-5336,dogglebie1s@netlog.com,aliquam non mauris morbi non lectus aliquam sit amet diam,Darby Ogglebie,763-772-3309,dogglebie1s@ifeng.com,75,65
2018-11-27,Dynabox,Babette Skynner,498-784-0302,sricardou1t@wp.com,lectus in est risus auctor sed tristique in tempus sit,Sawyer Ricardou,191-782-6031,sricardou1t@mozilla.org,76,66
2019-06-04,Thoughtblab,Aguie Polfer,250-158-1798,kbimrose1u@yelp.com,pede ullamcorper augue a suscipit nulla elit ac nulla sed,Kessia Bimrose,221-202-5253,kbimrose1u@wikimedia.org,77,67
2019-05-14,Skyvu,Cosme Mariot,453-820-1479,apentelo1v@creativecommons.org,quam sapien varius ut blandit non interdum in ante vestibulum,Adelaida Pentelo,180-545-9086,apentelo1v@apple.com,78,68
2018-12-13,Vidoo,Pernell Savin,633-297-4831,epacker1w@blogs.com,posuere felis sed lacus morbi sem mauris laoreet ut rhoncus,Eben Packer,392-433-1998,epacker1w@nydailynews.com,79,69
2019-07-07,Camimbo,Henrietta MacDougall,723-551-0287,mchazette1x@skyrock.com,mattis odio donec vitae nisi nam ultrices libero non mattis,Marlie Chazette,420-295-9544,mchazette1x@squidoo.com,80,70
2018-11-05,Youtags,Celina Helks,326-471-4969,ldrable1y@i2i.jp,congue eget semper rutrum nulla nunc purus phasellus in felis,Loleta Drable,713-193-8796,ldrable1y@examiner.com,81,71
2019-07-12,Twitterbridge,Ferdinanda Gallamore,656-806-6063,aeccott1z@java.com,vestibulum aliquet ultrices erat tortor sollicitudin mi sit amet lobortis,Allayne Eccott,188-480-8887,aeccott1z@qq.com,82,72
2018-11-01,Tagcat,Trenton Adger,883-532-0174,hbiggins20@mapquest.com,eu nibh quisque id justo sit amet sapien dignissim vestibulum,Henryetta Biggins,388-364-7763,hbiggins20@army.mil,83,73
2019-01-11,Mynte,Jefferey Crowhurst,526-186-8187,mgrady21@tiny.cc,vel accumsan tellus nisi eu orci mauris lacinia sapien quis,Maurie Grady,909-377-7963,mgrady21@networkadvertising.org,84,74
2019-07-10,Latz,Kristal Keford,302-387-0440,mrenzini22@irs.gov,potenti nullam porttitor lacus at turpis donec posuere metus vitae,Myrle Renzini,851-938-3425,mrenzini22@springer.com,85,75
2018-08-01,Dynava,Fayina Scopyn,828-372-8285,cfedynski23@zimbio.com,vehicula condimentum curabitur in libero ut massa volutpat convallis morbi,Catlaina Fedynski,495-247-4656,cfedynski23@tmall.com,86,76
2019-06-01,Meembee,Mortie Scrace,843-146-5788,kbarkshire24@ihg.com,ornare imperdiet sapien urna pretium nisl ut volutpat sapien arcu,Kathy Barkshire,592-762-2715,kbarkshire24@miitbeian.gov.cn,87,77
2019-05-01,Jayo,Betti Barkshire,720-157-3364,aeyam25@ask.com,convallis eget eleifend luctus ultricies eu nibh quisque id justo,Arlyn Eyam,602-217-2489,aeyam25@huffingtonpost.com,88,78
2018-10-08,Dabjam,Franklyn Pruckner,624-672-1492,lfrosdick26@washingtonpost.com,faucibus cursus urna ut tellus nulla ut erat id mauris,Lilli Frosdick,593-895-2394,lfrosdick26@tamu.edu,89,79
2019-05-20,Yacero,Nickolai Goodbairn,788-617-7488,rjilkes27@deliciousdays.com,aliquam augue quam sollicitudin vitae consectetuer eget rutrum at lorem,Robby Jilkes,961-463-8015,rjilkes27@gnu.org,90,80
2019-01-11,Feedbug,Eleonora Rowland,789-532-0185,gcrut28@youku.com,aliquet at feugiat non pretium quis lectus suspendisse potenti in,Guendolen Crut,529-706-5824,gcrut28@nps.gov,91,81
2019-01-15,Jazzy,Drew Gauchier,928-121-2504,wmoan29@nymag.com,viverra pede ac diam cras pellentesque volutpat dui maecenas tristique,Wernher Moan,182-111-3404,wmoan29@blog.com,92,82
2019-04-12,Cogilith,Aime Groomebridge,511-489-1431,amcreedy2a@ucoz.com,felis donec semper sapien a libero nam dui proin leo,Aida McReedy,356-359-1798,amcreedy2a@pbs.org,93,83
2019-02-01,Kwimbee,Jojo Eirwin,327-611-8654,ecrome2b@bluehost.com,proin interdum mauris non ligula pellentesque ultrices phasellus id sapien,Etienne Crome,811-993-2581,ecrome2b@163.com,94,84
2019-05-17,Abatz,Quillan Lethley,863-620-6014,fcrossland2c@godaddy.com,non ligula pellentesque ultrices phasellus id sapien in sapien iaculis,Fenelia Crossland,254-369-0323,fcrossland2c@usda.gov,95,85
2019-05-25,Divanoodle,Dorian Haresnaip,781-589-3384,hstrete2d@is.gd,vestibulum ante ipsum primis in faucibus orci luctus et ultrices,Hayley Strete,969-290-5216,hstrete2d@eepurl.com,96,86
2018-10-24,Abata,Vernice Bravey,354-448-7752,dfranzonello2e@elegantthemes.com,dignissim vestibulum vestibulum ante ipsum primis in faucibus orci luctus,Dalli Franzonello,192-804-5174,dfranzonello2e@privacy.gov.au,97,87
2018-07-15,Rhynyx,Gusty Carwithim,841-598-2121,glies2f@nydailynews.com,turpis nec euismod scelerisque quam turpis adipiscing lorem vitae mattis,Gleda Lies,107-527-2036,glies2f@clickbank.net,98,88
2019-06-25,Voolith,Malia Duckit,469-172-6524,lmatyushkin2g@comsenz.com,sit amet turpis elementum ligula vehicula consequat morbi a ipsum,Lorrayne Matyushkin,198-908-3062,lmatyushkin2g@economist.com,99,89
2018-12-03,Trudeo,Abba Arbuckel,838-739-6702,ckemitt2h@springer.com,justo sollicitudin ut suscipit a feugiat et eros vestibulum ac,Cobbie Kemitt,404-623-2685,ckemitt2h@amazon.de,100,90
2019-05-14,Skippad,Deirdre Mably,987-441-9325,akirke2i@washingtonpost.com,accumsan tellus nisi eu orci mauris lacinia sapien quis libero,Ambrose Kirke,685-673-3604,akirke2i@kickstarter.com,101,91
2019-04-11,Jabbersphere,Kimble Thynn,155-907-2174,amcquillen2j@msu.edu,turpis integer aliquet massa id lobortis convallis tortor risus dapibus,Abraham McQuillen,493-521-3551,amcquillen2j@hostgator.com,102,92
2018-10-28,Fivebridge,Micaela Mollison,606-125-1738,ahousecroft2k@t-online.de,morbi vestibulum velit id pretium iaculis diam erat fermentum justo,Aurie Housecroft,286-362-8506,ahousecroft2k@wikimedia.org,103,93
2019-02-04,Shufflester,Alexio Koeppke,959-803-3516,mpow2l@e-recht24.de,sit amet sem fusce consequat nulla nisl nunc nisl duis,Marcella Pow,935-265-2175,mpow2l@cdc.gov,104,94
2019-03-12,Jetpulse,Dore Cleworth,362-470-6866,zzarb2m@go.com,ultrices posuere cubilia curae nulla dapibus dolor vel est donec,Zolly Zarb,783-863-9725,zzarb2m@multiply.com,105,95
2019-04-19,Kwimbee,Mic Slyford,313-679-6540,rbabbe2n@senate.gov,volutpat convallis morbi odio odio elementum eu interdum eu tincidunt,Rose Babbe,173-985-9039,rbabbe2n@salon.com,106,96
2019-05-01,Twinder,Marquita Budcock,245-168-7774,fgrzes2o@home.pl,rhoncus mauris enim leo rhoncus sed vestibulum sit amet cursus,Flori Grzes,857-253-8445,fgrzes2o@admin.ch,107,97
2018-09-18,Jaxspan,Cesar Bemment,458-902-8603,sdumigan2p@icq.com,tempus vivamus in felis eu sapien cursus vestibulum proin eu,Sidney Dumigan,285-986-1931,sdumigan2p@bloomberg.com,108,98
2018-08-16,Zoomdog,Drusie Cominetti,668-953-0387,fmcclymont2q@auda.org.au,id nulla ultrices aliquet maecenas leo odio condimentum id luctus,Field McClymont,713-613-0631,fmcclymont2q@amazon.co.jp,109,99
2018-09-18,Thoughtstorm,Bailie Rapelli,146-576-7115,dgawith2r@merriam-webster.com,ipsum aliquam non mauris morbi non lectus aliquam sit amet,Dennie Gawith,361-712-9809,dgawith2r@cocolog-nifty.com,110,100
2018-08-01,Meezzy,Elizabet Twaits,927-622-4346,povitz2s@webnode.com,integer ac leo pellentesque ultrices mattis odio donec vitae nisi,Pen Ovitz,929-717-6005,povitz2s@mediafire.com,111,101
2019-05-13,Avamba,Alberik Inskipp,426-890-2065,fhakeworth2t@alibaba.com,congue risus semper porta volutpat quam pede lobortis ligula sit,Franz Hakeworth,241-231-1330,fhakeworth2t@msu.edu,112,102
2019-03-14,Centimia,Sapphire Harmes,882-428-3402,credholls2u@ca.gov,odio consequat varius integer ac leo pellentesque ultrices mattis odio,Carlotta Redholls,616-651-7527,credholls2u@domainmarket.com,113,103
2019-02-20,Divavu,Tucker Francomb,212-818-1065,hmanners2v@opensource.org,donec odio justo sollicitudin ut suscipit a feugiat et eros,Hillary Manners,379-538-6716,hmanners2v@typepad.com,114,104
2019-04-12,Brainbox,Laura Scrafton,120-334-4954,shodgen2w@is.gd,in libero ut massa volutpat convallis morbi odio odio elementum,Starla Hodgen,935-937-2151,shodgen2w@go.com,115,105
2019-01-14,Leexo,Timi Avieson,292-843-4177,sholtum2x@independent.co.uk,quam turpis adipiscing lorem vitae mattis nibh ligula nec sem,Sherilyn Holtum,228-287-4062,sholtum2x@marriott.com,116,106
2019-06-03,Yakidoo,Stacia Asbury,740-598-2817,nskillman2y@imageshack.us,eu felis fusce posuere felis sed lacus morbi sem mauris,Niki Skillman,676-493-2900,nskillman2y@paginegialle.it,117,107
2019-01-16,Thoughtstorm,Bucky Dray,355-987-2297,ggrandison2z@flickr.com,ultrices posuere cubilia curae mauris viverra diam vitae quam suspendisse,Gerrie Grandison,183-156-7600,ggrandison2z@dagondesign.com,118,108
2018-08-14,Realbridge,Bastian Nisot,445-272-0077,tlidell30@google.co.uk,a odio in hac habitasse platea dictumst maecenas ut massa,Tilda Lidell,413-158-0369,tlidell30@fastcompany.com,119,109
2018-09-29,Zoomlounge,Aldis Shatford,413-834-0650,jhawtrey31@jiathis.com,vestibulum quam sapien varius ut blandit non interdum in ante,Jacintha Hawtrey,619-303-1158,jhawtrey31@washington.edu,120,110
2018-10-20,Teklist,Idalia Clabburn,552-406-6693,rcowely32@paginegialle.it,eros suspendisse accumsan tortor quis turpis sed ante vivamus tortor,Rori Cowely,649-787-2538,rcowely32@miibeian.gov.cn,121,111
2018-07-17,Feedfish,Marius Kielt,717-763-7793,sshand33@state.gov,in est risus auctor sed tristique in tempus sit amet,Shell Shand,102-639-7880,sshand33@g.co,122,112
2019-01-23,Zoomlounge,Cecilio Ayrton,197-354-6939,tglendzer34@php.net,sit amet sapien dignissim vestibulum vestibulum ante ipsum primis in,Timofei Glendzer,632-994-6650,tglendzer34@ftc.gov,123,113
2018-10-13,Skidoo,Dorian Rands,352-679-0197,bgentsch35@japanpost.jp,vulputate luctus cum sociis natoque penatibus et magnis dis parturient,Babs Gentsch,699-979-8901,bgentsch35@skype.com,124,114
2018-08-26,Shuffledrive,Flore Riquet,802-390-5115,wmccoveney36@ehow.com,vitae ipsum aliquam non mauris morbi non lectus aliquam sit,Wandie McCoveney,604-688-8829,wmccoveney36@ucla.edu,125,115
2018-12-06,Flipbug,Rozalie Pawlaczyk,617-264-9442,lcosty37@google.com.hk,luctus cum sociis natoque penatibus et magnis dis parturient montes,Lavena Costy,951-634-8894,lcosty37@ezinearticles.com,126,116
2018-09-26,Meetz,Sacha Liddy,305-915-0643,sbronger38@bloomberg.com,justo lacinia eget tincidunt eget tempus vel pede morbi porttitor,Starla Bronger,917-170-0239,sbronger38@wp.com,127,117
2019-02-18,Eayo,Lottie Sugar,380-749-5865,mterbruggen39@1688.com,curabitur in libero ut massa volutpat convallis morbi odio odio,Marcia Terbruggen,397-337-2197,mterbruggen39@redcross.org,128,118
2019-03-20,Zooxo,Anny Mauditt,538-413-5522,bfarge3a@pen.io,in hac habitasse platea dictumst aliquam augue quam sollicitudin vitae,Brittney Farge,797-681-2081,bfarge3a@altervista.org,129,119
2019-04-17,Trupe,Cindi Iglesias,813-667-4699,mpetkens3b@unblog.fr,nulla ultrices aliquet maecenas leo odio condimentum id luctus nec,Mariquilla Petkens,380-589-8225,mpetkens3b@jimdo.com,130,120
2019-07-08,Skippad,Flory Pessolt,218-938-7562,dpittel3c@flickr.com,aliquet maecenas leo odio condimentum id luctus nec molestie sed,Danya Pittel,734-843-0005,dpittel3c@google.com.hk,131,121
2019-06-13,Edgeclub,Bourke McNair,253-787-3158,obulward3d@sakura.ne.jp,duis mattis egestas metus aenean fermentum donec ut mauris eget,Odella Bulward,666-710-8675,obulward3d@opera.com,132,122
2019-07-06,Topicware,Lyn Dunphie,496-932-7952,bdedmam3e@chicagotribune.com,aliquam non mauris morbi non lectus aliquam sit amet diam,Briana Dedmam,446-726-5851,bdedmam3e@technorati.com,133,123
2018-09-21,Thoughtbridge,Gaultiero Sharrem,223-575-8571,cstackbridge3f@nydailynews.com,in hac habitasse platea dictumst etiam faucibus cursus urna ut,Conway Stackbridge,851-884-0802,cstackbridge3f@oakley.com,134,124
2018-10-21,Twimm,Westley Franzini,586-938-9832,rhuckle3g@dot.gov,vitae consectetuer eget rutrum at lorem integer tincidunt ante vel,Roselin Huckle,543-279-0989,rhuckle3g@chronoengine.com,135,125
2019-05-22,Bluejam,Janenna Rusbridge,268-500-9977,lcotterel3h@t-online.de,eros vestibulum ac est lacinia nisi venenatis tristique fusce congue,Lorin Cotterel,543-184-3885,lcotterel3h@issuu.com,136,126
2019-01-20,Quimba,Tuck Cathenod,939-435-6063,prusling3i@wired.com,pede ac diam cras pellentesque volutpat dui maecenas tristique est,Petey Rusling,495-459-6237,prusling3i@last.fm,137,127
2018-10-01,Leexo,Morey Charlet,342-997-6482,pstewart3j@opera.com,vivamus vestibulum sagittis sapien cum sociis natoque penatibus et magnis,Pip Stewart,953-199-9833,pstewart3j@census.gov,138,128
2019-03-16,Ooba,Rennie Haller,276-728-0157,cmcglone3k@toplist.cz,ante vel ipsum praesent blandit lacinia erat vestibulum sed magna,Caro McGlone,308-225-3418,cmcglone3k@mit.edu,139,129
2019-03-04,Ntags,Sheilah Peyton,710-180-6411,jkemble3l@businessinsider.com,morbi sem mauris laoreet ut rhoncus aliquet pulvinar sed nisl,Jobey Kemble,254-473-1796,jkemble3l@smugmug.com,140,130
2018-08-04,Yambee,Lucian Vizard,727-707-1199,ygarbar3m@yelp.com,quam sapien varius ut blandit non interdum in ante vestibulum,Yard Garbar,811-950-1939,ygarbar3m@amazon.com,141,131
2018-10-26,Jabberstorm,Millisent Poyzer,846-571-1053,dpaulack3n@trellian.com,augue quam sollicitudin vitae consectetuer eget rutrum at lorem integer,Dorothy Paulack,630-399-2582,dpaulack3n@paginegialle.it,142,132
2018-11-29,Vidoo,Kipp Kanwell,546-620-6468,rkohnemann3o@trellian.com,platea dictumst etiam faucibus cursus urna ut tellus nulla ut,Reginald Kohnemann,583-143-2371,rkohnemann3o@gravatar.com,143,133
2018-11-08,Skajo,Johnette Howden,111-880-8789,efugere3p@google.co.jp,vestibulum eget vulputate ut ultrices vel augue vestibulum ante ipsum,Erica Fugere,997-902-2104,efugere3p@weibo.com,144,134
