creation_date,business_name,contact_name,contact_phone,email_contact,business_descrition,name_service_contact,phone_service_contact,email_service_contact,user_id,address_id
2019-07-07,Browsezoom,Matthaeus Cocker,754-573-4066,emulvihill3q@rediff.com,interdum eu tincidunt in leo maecenas pulvinar lobortis est phasellus,Eberhard Mulvihill,323-981-7967,emulvihill3q@hexun.com,145,135
2019-06-23,Thoughtstorm,Hadrian Gleadhell,522-528-2163,hwhitticks3r@vimeo.com,fusce lacus purus aliquet at feugiat non pretium quis lectus,Haslett Whitticks,546-933-0143,hwhitticks3r@soup.io,146,136
2019-04-04,Buzzbean,Abagael Dowd,264-928-6823,vrzehorz3s@tuttocitta.it,libero non mattis pulvinar nulla pede ullamcorper augue a suscipit,Victoria Rzehorz,957-276-2367,vrzehorz3s@people.com.cn,147,137
2018-11-23,Yambee,Antoine Bortolomei,432-749-9172,halcalde3t@youtube.com,metus arcu adipiscing molestie hendrerit at vulputate vitae nisl aenean,Helena Alcalde,777-762-5578,halcalde3t@hugedomains.com,148,138
2018-11-18,Photolist,Michaeline Guye,801-319-1365,lsilbert3u@usnews.com,at velit vivamus vel nulla eget eros elementum pellentesque quisque,Lyssa Silbert,910-322-9742,lsilbert3u@hexun.com,149,139
2019-06-25,Blogpad,Conrado Shenfisch,750-246-1313,umcrae3v@irs.gov,aliquam convallis nunc proin at turpis a pede posuere nonummy,Ulick McRae,175-950-4613,umcrae3v@un.org,150,140
2018-11-23,Ooba,Odelia McTeggart,192-457-2991,kjenner3w@i2i.jp,a odio in hac habitasse platea dictumst maecenas ut massa,Kit Jenner,580-603-3088,kjenner3w@salon.com,151,141
2018-07-19,Vitz,Janelle Syfax,252-617-3687,kclinkard3x@4shared.com,pede justo eu massa donec dapibus duis at velit eu,Karia Clinkard,512-144-2093,kclinkard3x@angelfire.com,152,142
2018-07-30,Voonyx,Obed Tremberth,310-103-3212,lallberry3y@independent.co.uk,faucibus orci luctus et ultrices posuere cubilia curae mauris viverra,Loydie Allberry,318-624-3424,lallberry3y@dagondesign.com,153,143
2018-08-26,Blogtag,Patten Curman,864-456-9124,cmonkton3z@theglobeandmail.com,lacus purus aliquet at feugiat non pretium quis lectus suspendisse,Colette Monkton,327-829-0268,cmonkton3z@angelfire.com,154,144
2018-09-25,Eayo,Solomon Beddow,176-181-8959,agabbetis40@miitbeian.gov.cn,primis in faucibus orci luctus et ultrices posuere cubilia curae,Abra Gabbetis,856-896-2665,agabbetis40@google.es,155,145
2019-01-18,Lajo,Jory Argo,952-488-1402,bpoetz41@drupal.org,nunc donec quis orci eget orci vehicula condimentum curabitur in,Brendon Poetz,529-506-8586,bpoetz41@etsy.com,156,146
2018-09-22,Digitube,Rabi Deport,496-848-2450,bbodley42@livejournal.com,non mauris morbi non lectus aliquam sit amet diam in,Bruis Bodley,538-197-2592,bbodley42@bandcamp.com,157,147
2019-02-17,Oyoloo,Lem Pinxton,921-364-8973,dbowery43@prlog.org,ultrices vel augue vestibulum ante ipsum primis in faucibus orci,Dione Bowery,715-599-3780,dbowery43@dyndns.org,158,148
2019-07-04,Oyoyo,Keri Biasioli,117-953-0491,mcarneck44@baidu.com,suspendisse potenti cras in purus eu magna vulputate luctus cum,Micki Carneck,442-772-5993,mcarneck44@prweb.com,159,149
2018-09-14,Brainlounge,Margery Grenshiels,514-135-2175,tberkery45@unesco.org,nulla pede ullamcorper augue a suscipit nulla elit ac nulla,Tilly Berkery,204-483-5665,tberkery45@archive.org,160,150
2019-06-05,Wordpedia,Jordan Niave,425-876-1867,lquainton46@icq.com,arcu sed augue aliquam erat volutpat in congue etiam justo,Lindy Quainton,516-121-6056,lquainton46@apple.com,161,151
2019-03-03,Fadeo,Quintana Dickinson,216-278-5827,asear47@wufoo.com,montes nascetur ridiculus mus etiam vel augue vestibulum rutrum rutrum,Anny Sear,372-378-9259,asear47@twitter.com,162,152
2019-01-13,Centimia,Sherwood Napier,901-286-8653,fsandells48@devhub.com,amet nunc viverra dapibus nulla suscipit ligula in lacus curabitur,Farah Sandells,312-748-0722,fsandells48@odnoklassniki.ru,163,153
2018-11-09,Jayo,Alric Reedman,828-556-6011,amacpaike49@google.de,elementum ligula vehicula consequat morbi a ipsum integer a nibh,Ailyn MacPaike,530-244-8296,amacpaike49@storify.com,164,154
2019-06-03,Vipe,Brunhilda Starmont,199-306-0288,wbelli4a@ustream.tv,nulla dapibus dolor vel est donec odio justo sollicitudin ut,Wini Belli,421-559-2744,wbelli4a@yellowbook.com,165,155
2018-10-24,Tagchat,Evvy Voak,554-753-1517,tsarten4b@forbes.com,erat tortor sollicitudin mi sit amet lobortis sapien sapien non,Thatcher Sarten,907-469-5840,tsarten4b@linkedin.com,166,156
2019-05-29,Zooxo,Jorie Adamiak,489-429-3177,todell4c@mtv.com,amet eleifend pede libero quis orci nullam molestie nibh in,Therese Odell,103-586-1078,todell4c@craigslist.org,167,157
2019-01-27,Mycat,Thoma Greggor,267-884-1366,kmcphelim4d@google.com.hk,in est risus auctor sed tristique in tempus sit amet,Kellen McPhelim,507-442-7706,kmcphelim4d@walmart.com,168,158
2019-02-15,Quatz,Archy Normant,644-426-0790,bbowland4e@cargocollective.com,felis eu sapien cursus vestibulum proin eu mi nulla ac,Babb Bowland,622-546-5826,bbowland4e@yahoo.com,169,159
2018-08-14,Quamba,Leyla Jagson,608-334-6274,adron4f@independent.co.uk,quisque arcu libero rutrum ac lobortis vel dapibus at diam,Aurie Dron,129-487-5948,adron4f@xing.com,170,160
2019-05-13,Tagopia,Ferdinande McVitie,243-534-0646,gpettett4g@harvard.edu,ante vestibulum ante ipsum primis in faucibus orci luctus et,Gardner Pettett,360-539-7443,gpettett4g@delicious.com,171,161
2018-11-03,Gigaclub,Claire Fawdry,407-619-6632,sfabry4h@theatlantic.com,penatibus et magnis dis parturient montes nascetur ridiculus mus vivamus,Steven Fabry,921-595-0700,sfabry4h@gov.uk,172,162
2019-06-17,Demivee,Mackenzie Lankford,653-465-4553,rsugden4i@e-recht24.de,habitasse platea dictumst aliquam augue quam sollicitudin vitae consectetuer eget,Roderigo Sugden,866-339-8829,rsugden4i@canalblog.com,173,163
2018-12-08,Tagcat,Meggie Croneen,315-618-3554,hrowesby4j@people.com.cn,gravida sem praesent id massa id nisl venenatis lacinia aenean,Hinda Rowesby,105-903-3681,hrowesby4j@home.pl,174,164
2019-07-07,Oyoba,Kaylee Lightman,440-370-0277,emckerley4k@uiuc.edu,pede venenatis non sodales sed tincidunt eu felis fusce posuere,Elvyn McKerley,432-832-1208,emckerley4k@toplist.cz,175,165
2018-12-30,Zoozzy,Vincents Bothe,710-466-4146,esamudio4l@i2i.jp,a pede posuere nonummy integer non velit donec diam neque,Emmet Samudio,600-849-6003,esamudio4l@jiathis.com,176,166
2019-04-02,Buzzdog,Brand Slemming,551-321-0226,tworsnap4m@wufoo.com,amet cursus id turpis integer aliquet massa id lobortis convallis,Tildy Worsnap,205-997-9452,tworsnap4m@uol.com.br,177,167
2019-03-05,Edgeify,Cullie Banaszewski,639-395-8223,rskone4n@hp.com,convallis eget eleifend luctus ultricies eu nibh quisque id justo,Ros Skone,518-378-9612,rskone4n@g.co,178,168
2018-08-07,Thoughtworks,Caril Heggs,350-395-3426,wbrewins4o@msn.com,felis eu sapien cursus vestibulum proin eu mi nulla ac,Warner Brewins,940-621-9649,wbrewins4o@flickr.com,179,169
2018-11-26,Twitterworks,Dorine Spiaggia,578-678-0961,jscrammage4p@blogger.com,velit vivamus vel nulla eget eros elementum pellentesque quisque porta,Jeane Scrammage,877-617-7188,jscrammage4p@examiner.com,180,170
2019-02-09,Twimbo,Adoree Darke,240-535-0554,blukock4q@acquirethisname.com,praesent blandit lacinia erat vestibulum sed magna at nunc commodo,Bonita Lukock,859-400-9277,blukock4q@diigo.com,181,171
2019-06-16,Twitterbeat,Myranda Bruggeman,957-565-3316,rsharville4r@dot.gov,sapien cum sociis natoque penatibus et magnis dis parturient montes,Rolando Sharville,887-946-9290,rsharville4r@oakley.com,182,172
2019-06-08,Meeveo,Larine Whittam,707-571-9651,rmalyan4s@hhs.gov,nec dui luctus rutrum nulla tellus in sagittis dui vel,Rozina Malyan,232-533-9837,rmalyan4s@cloudflare.com,183,173
2018-12-14,Jaxspan,Rock Dorman,413-140-1435,lmoff4t@livejournal.com,nibh fusce lacus purus aliquet at feugiat non pretium quis,Lonee Moff,422-696-3690,lmoff4t@psu.edu,184,174
2018-11-14,Skinte,Isaiah Lambot,744-720-1546,kde4u@state.gov,eu sapien cursus vestibulum proin eu mi nulla ac enim,Keith De la Yglesia,678-660-8432,kde4u@biglobe.ne.jp,185,175
2018-10-28,Oyoba,Rivalee OHear,315-307-7902,ocluatt4v@nyu.edu,quis orci nullam molestie nibh in lectus pellentesque at nulla,Orella Cluatt,713-137-3416,ocluatt4v@samsung.com,186,176
2019-06-03,Roodel,Rivkah Romme,367-484-4865,tgaze4w@fc2.com,dolor vel est donec odio justo sollicitudin ut suscipit a,Timmi Gaze,431-357-4729,tgaze4w@hugedomains.com,187,177
2019-02-18,Browsetype,Sydney Lundbeck,895-529-3580,bwheadon4x@auda.org.au,ac enim in tempor turpis nec euismod scelerisque quam turpis,Benedicto Wheadon,287-627-0524,bwheadon4x@independent.co.uk,188,178
2019-05-29,Topicshots,Nichole Eriksson,761-724-6468,abrunsden4y@hhs.gov,ornare imperdiet sapien urna pretium nisl ut volutpat sapien arcu,Antons Brunsden,310-748-6406,abrunsden4y@gov.uk,189,179
2018-07-13,LiveZ,Faustina Stribling,820-956-2127,dminucci4z@macromedia.com,leo rhoncus sed vestibulum sit amet cursus id turpis integer,Dyna Minucci,932-332-9496,dminucci4z@vinaora.com,190,180
2019-03-23,Yodoo,Robbi Pegden,588-594-9179,lpetrolli50@vinaora.com,at velit vivamus vel nulla eget eros elementum pellentesque quisque,Lina Petrolli,692-362-8683,lpetrolli50@redcross.org,191,181
2018-09-14,Gigashots,Carolus Crassweller,475-765-3273,creaney51@marriott.com,turpis sed ante vivamus tortor duis mattis egestas metus aenean,Clarabelle Reaney,738-895-8751,creaney51@apple.com,192,182
2019-05-22,Chatterbridge,Giralda Larver,197-909-6358,ldibley52@blogspot.com,tincidunt lacus at velit vivamus vel nulla eget eros elementum,Lemar Dibley,169-751-8454,ldibley52@angelfire.com,193,183
2019-03-30,Eadel,Joel Vassbender,934-126-7727,sharby53@google.pl,blandit nam nulla integer pede justo lacinia eget tincidunt eget,Skyler Harby,576-362-3381,sharby53@netlog.com,194,184
2019-03-07,Yozio,Hadleigh Gwilym,753-205-0459,afyfe54@latimes.com,condimentum curabitur in libero ut massa volutpat convallis morbi odio,Arlene Fyfe,442-528-8241,afyfe54@wikispaces.com,195,185
2018-11-01,Yozio,Dorette Sabatini,169-797-7305,kdelgardo55@msn.com,dignissim vestibulum vestibulum ante ipsum primis in faucibus orci luctus,Kiley Delgardo,682-412-1221,kdelgardo55@netscape.com,196,186
2019-01-27,Bubbletube,Judas Clara,495-234-9799,mrambadt56@desdev.cn,cubilia curae mauris viverra diam vitae quam suspendisse potenti nullam,Maddi Rambadt,121-263-2749,mrambadt56@blogs.com,197,187
2018-08-12,Photobug,Ronda Goldwater,804-380-6946,amacmakin57@dedecms.com,quis augue luctus tincidunt nulla mollis molestie lorem quisque ut,Aldric MacMakin,596-301-7854,amacmakin57@pagesperso-orange.fr,198,188
2018-09-25,Realpoint,Robbin Kabsch,476-300-5916,redeler58@etsy.com,habitasse platea dictumst morbi vestibulum velit id pretium iaculis diam,Rivkah Edeler,825-875-1825,redeler58@github.com,199,189
2019-03-09,Bubblebox,Merrile Labet,426-997-7233,dmcbrier59@1688.com,volutpat eleifend donec ut dolor morbi vel lectus in quam,Domenico McBrier,476-786-3377,dmcbrier59@yandex.ru,200,190
2019-04-24,Tagopia,Idell Uphill,193-712-3123,gmanuelli5a@i2i.jp,pellentesque ultrices mattis odio donec vitae nisi nam ultrices libero,Gabriela Manuelli,183-613-4218,gmanuelli5a@google.com.au,201,191
2019-04-13,JumpXS,Brnaba Andrin,533-764-6873,nrockwell5b@blogtalkradio.com,luctus ultricies eu nibh quisque id justo sit amet sapien,Nerissa Rockwell,816-328-8789,nrockwell5b@vistaprint.com,202,192
2018-08-12,Buzzshare,Agnola McKevitt,258-295-9105,vsaenz5c@4shared.com,varius integer ac leo pellentesque ultrices mattis odio donec vitae,Van Saenz,713-962-8556,vsaenz5c@webeden.co.uk,203,193
2018-10-23,Browsebug,Patric Effnert,602-418-5667,dnation5d@ocn.ne.jp,vestibulum rutrum rutrum neque aenean auctor gravida sem praesent id,Davy Nation,756-227-2808,dnation5d@friendfeed.com,204,194
2018-07-26,Gabcube,Noreen Esilmon,851-815-9873,okleyn5e@umich.edu,consectetuer adipiscing elit proin interdum mauris non ligula pellentesque ultrices,Otto Kleyn,972-255-2103,okleyn5e@apple.com,205,195
2018-12-19,Eidel,Jehu Melmoth,421-845-5131,eleggatt5f@zimbio.com,odio consequat varius integer ac leo pellentesque ultrices mattis odio,Eva Leggatt,933-609-6917,eleggatt5f@people.com.cn,206,196
2018-10-15,Linklinks,Hartley Osanne,859-411-9915,bmcparland5g@mapy.cz,pellentesque at nulla suspendisse potenti cras in purus eu magna,Basilius McParland,190-303-6991,bmcparland5g@ow.ly,207,197
2018-12-13,Yozio,Jay Fechnie,552-784-4760,mboddie5h@wufoo.com,velit donec diam neque vestibulum eget vulputate ut ultrices vel,Mozes Boddie,426-784-9560,mboddie5h@taobao.com,208,198
2019-03-30,Flipstorm,Georgena Ashmole,787-665-3697,okeyden5i@vistaprint.com,semper est quam pharetra magna ac consequat metus sapien ut,Olin Keyden,984-822-6803,okeyden5i@oracle.com,209,199
2018-11-15,Brainverse,Julie Illes,423-590-3596,djermey5j@cisco.com,rutrum ac lobortis vel dapibus at diam nam tristique tortor,Denny Jermey,728-257-3624,djermey5j@eepurl.com,210,200
